mysql> create database AddressBook;
Query OK, 1 row affected (2.63 sec)

mysql> show databases;
+--------------------+
| Database           |
+--------------------+
| addressbook        |
| information_schema |
| mysql              |
| ok                 |
| payroll_service    |
| payroll_service1   |
| performance_schema |
| sakila             |
| sys                |
| world              |
+--------------------+
10 rows in set (1.97 sec)

#UC-2

mysql> create table addressbook
    -> (
    -> id               INT unsigned NOT NULL AUTO_INCREMENT,
    -> firstname                varchar(150) not null,
    -> lastname                 varchar(150) not null,
    -> address                  varchar(200) not null,
    -> city                     varchar(200) not null,
    -> zip                      int(50) not null,
    ->  phonenumber              int(200) not null,
    -> PRIMARY KEY              (id)
    -> );
Query OK, 0 rows affected, 2 warnings (5.58 sec)

mysql> describe addressbook
    -> ;
+-------------+--------------+------+-----+---------+----------------+
| Field       | Type         | Null | Key | Default | Extra          |
+-------------+--------------+------+-----+---------+----------------+
| id          | int unsigned | NO   | PRI | NULL    | auto_increment |
| firstname   | varchar(150) | NO   |     | NULL    |                |
| lastname    | varchar(150) | NO   |     | NULL    |                |
| address     | varchar(200) | NO   |     | NULL    |                |
| city        | varchar(200) | NO   |     | NULL    |                |
| zip         | int          | NO   |     | NULL    |                |
| phonenumber | int          | NO   |     | NULL    |                |
+-------------+--------------+------+-----+---------+----------------+
7 rows in set (0.23 sec)


#UC-3


mysql> insert into addressbook(firstname, lastname, address, city, zip, phonenumber) VALUES
    -> ('VISHNU', 'VARDHAN', 'ATTEKALLU', 'KURNOOL', '518347', '958146'),
    -> ('KVV', 'VARDHAN', 'BILLEKALLU', 'ASPARI', '518654', '83047'),
    -> ('KVV', 'VISHNU', 'PATTIKONDA', 'TUGGALI', '518698', '83047');
Query OK, 3 rows affected (1.94 sec)
Records: 3  Duplicates: 0  Warnings: 0

mysql> select * from addressbook;
+----+-----------+----------+------------+---------+--------+-------------+
| id | firstname | lastname | address    | city    | zip    | phonenumber |
+----+-----------+----------+------------+---------+--------+-------------+
|  1 | VISHNU    | VARDHAN  | ATTEKALLU  | KURNOOL | 518347 |      958146 |
|  2 | KVV       | VARDHAN  | BILLEKALLU | ASPARI  | 518654 |       83047 |
|  3 | KVV       | VISHNU   | PATTIKONDA | TUGGALI | 518698 |       83047 |
+----+-----------+----------+------------+---------+--------+-------------+
3 rows in set (0.00 sec)


#UC-4


mysql> update addressbook set firstname = 'BILL GATES' where lastname ='ELON MUSK';
Query OK, 0 rows affected (0.00 sec)
Rows matched: 0  Changed: 0  Warnings: 0

mysql> select * from addressbook;
+----+-----------+----------+------------+---------+--------+-------------+
| id | firstname | lastname | address    | city    | zip    | phonenumber |
+----+-----------+----------+------------+---------+--------+-------------+
|  1 | VISHNU    | VARDHAN  | ATTEKALLU  | KURNOOL | 518347 |      958146 |
|  2 | KVV       | VARDHAN  | BILLEKALLU | ASPARI  | 518654 |       83047 |
|  3 | KVV       | VISHNU   | PATTIKONDA | TUGGALI | 518698 |       83047 |
+----+-----------+----------+------------+---------+--------+-------------+
3 rows in set (0.00 sec)





